{
  "name": "docx-creation",
  "description": "Expert at creating and manipulating Word documents (.docx files)",
  "instructions": "# DOCX Creation Skill\n\n## When to Use\nUse this skill when you need to create, read, or modify Microsoft Word documents (.docx).\n\n## Prerequisites\n\nInstall python-docx:\n```bash\npip install python-docx\n```\n\n## Basic Usage\n\n### Creating a Document\n```python\nfrom docx import Document\n\ndoc = Document()\ndoc.add_heading('Document Title', 0)\ndoc.add_paragraph('This is a paragraph.')\ndoc.add_heading('Section 1', level=1)\ndoc.add_paragraph('Content here...')\n\ndoc.save('output.docx')\n```\n\n### Adding Tables\n```python\ntable = doc.add_table(rows=3, cols=2)\ntable.style = 'Light Grid Accent 1'\n\n# Header row\nhdr_cells = table.rows[0].cells\nhdr_cells[0].text = 'Name'\nhdr_cells[1].text = 'Value'\n\n# Data rows\nrow_cells = table.rows[1].cells\nrow_cells[0].text = 'Item 1'\nrow_cells[1].text = '100'\n```\n\n### Styling Text\n```python\nparagraph = doc.add_paragraph()\nrun = paragraph.add_run('Bold and italic text')\nrun.bold = True\nrun.italic = True\nrun.font.size = Pt(14)\nrun.font.color.rgb = RGBColor(0x42, 0x24, 0xE9)\n```\n\n## Best Practices\n1. Use styles consistently\n2. Set document margins appropriately\n3. Add page breaks for long documents\n4. Use tables for structured data\n5. Save frequently during complex operations",
  "version": "1.0.0",
  "tags": ["documents", "docx", "word", "office"],
  "providers": {
    "claude": true,
    "opencode": true,
    "gemini": true
  }
}
